title,company,category,status,min_edu,min_exp,description,urlJob,urlImg
Community Officer - MAJALENGKA,Bank BTPN Syariah Bandung,Marketing,Penuh Waktu · Kerja di kantor,Minimal SMA/SMK,1 - 3 tahun pengalaman,"Deskripsi pekerjaan Community Officer - MAJALENGKA Bank BTPN Syariah BandungJob DescriptionsBank BTPN Syariah, sebuah lembaga keuangan yang berkomitmen pada nilai-nilai syariah, membuka kesempatan bagi individu yang dinamis dan bersemangat untuk bergabung sebagai Community Officer.Menjalankan program sosialisasi produk pembiayaan modal usaha berbasis syariah di wilayah kecamatan yang ditentukan.Mengidentifikasi dan membangun hubungan baik dengan pelaku usaha lokal, terutama ibu-ibu yang tertarik memulai atau mengembangkan usaha mereka.Mendampingi calon nasabah dalam proses pengajuan pembiayaan, memberikan pemahaman mendalam tentang produk dan manfaat syariah.Menghadiri pertemuan kelompok rutin nasabah untuk memberikan dukungan dan menjawab pertanyaan terkait produk dan layanan.Job RequirementsPerempuan, usia 18-33 tahunPendidikan minimal SMA/SMK sederajat, D3 hingga S1Senang bepergian dan bertemu orangBisa mengendarai sepeda motorBenefits :Pendapatan tetaap, THR 2x gaji dan insetifJaminan kesehatan lengkap (BPJS, Asuransi Rawat Inap)Fasilitas tempat tinggal dan kendaraan kerjaProgram beasiswa Sarjana S1Hadiah perjalanan keluar negeriBerkesempatan ibadah umrohLihat Lebih Sedikit",https://glints.com/id/opportunities/jobs/community-officer-majalengka/a73d07ac-ed74-4092-ac02-591f3ab571e9?utm_referrer=explore&traceInfo=2706a172-3070-4025-b3ac-1f5d5e9fbf05,https://images.glints.com/unsafe/glints-dashboard.oss-ap-southeast-1.aliyuncs.com/company-logo/46f60806b1546422bf54a133e116fa40.png
Community Officer - CIREBON,Bank BTPN Syariah Bandung,Marketing,Penuh Waktu · Kerja di kantor,Minimal SMA/SMK,Pengalaman kurang dari 1 tahun,"Deskripsi pekerjaan Community Officer - CIREBON Bank BTPN Syariah BandungJob DescriptionsBank BTPN Syariah, sebuah lembaga keuangan yang berkomitmen pada nilai-nilai syariah, membuka kesempatan bagi individu yang dinamis dan bersemangat untuk bergabung sebagai Community Officer.Menjalankan program sosialisasi produk pembiayaan modal usaha berbasis syariah di wilayah kecamatan yang ditentukan.Mengidentifikasi dan membangun hubungan baik dengan pelaku usaha lokal, terutama ibu-ibu yang tertarik memulai atau mengembangkan usaha mereka.Mendampingi calon nasabah dalam proses pengajuan pembiayaan, memberikan pemahaman mendalam tentang produk dan manfaat syariah.Menghadiri pertemuan kelompok rutin nasabah untuk memberikan dukungan dan menjawab pertanyaan terkait produk dan layanan.Job RequirementsPerempuan, usia 18-33 tahunPendidikan minimal SMA/SMK sederajat, D3 hingga S1Senang bepergian dan bertemu orangBisa mengendarai sepeda motorBenefits :Pendapatan tetaap, THR 2x gaji dan insetifJaminan kesehatan lengkap (BPJS, Asuransi Rawat Inap)Fasilitas tempat tinggal dan kendaraan kerjaProgram beasiswa Sarjana S1Hadiah perjalanan keluar negeriBerkesempatan ibadah umrohLihat Lebih Sedikit",https://glints.com/id/opportunities/jobs/community-officer-cirebon/b89fd8ec-16a0-4ad2-9628-a69813cbbaf3?utm_referrer=explore&traceInfo=2706a172-3070-4025-b3ac-1f5d5e9fbf05,https://images.glints.com/unsafe/glints-dashboard.oss-ap-southeast-1.aliyuncs.com/company-logo/46f60806b1546422bf54a133e116fa40.png
Host Live Streaming,Heyxi Indonesia,Marketing,Penuh Waktu · Kerja di kantor,Minimal SMA/SMK,1 - 3 tahun pengalaman,"Deskripsi pekerjaan Host Live Streaming Heyxi IndonesiaKualifikasi : > Wanita> Umur 18-28 Th> Pendidikan Min. SMA/SMK Sedrajat > Pengalaman Bekerja di Salo Kecantikan> Memahami Cara Kerja Live Streaming > Memahami Tiktok Dan Shopee> Jujur, Ulet, Ceria, Dan Mau Belajar > Mampu Bekerja Dalam Tim> Perempuan Non-HijabLihat Lebih Sedikit",https://glints.com/id/opportunities/jobs/host-live-streaming/07a9a357-91b9-4367-87b4-ef43df3d1c24?utm_referrer=explore&traceInfo=2706a172-3070-4025-b3ac-1f5d5e9fbf05,https://images.glints.com/unsafe/glints-dashboard.oss-ap-southeast-1.aliyuncs.com/company-logo/88e785d5489a7737400845f37f384ba0.png
Internship Community,Bitjara.id (Bitjara),Marketing,Magang · Kerja di kantor,Minimal Sarjana (S1),1 - 3 tahun pengalaman,"Deskripsi pekerjaan Internship Community Bitjara.id (Bitjara)Internship Community BCC (Bitjara Creators Community)Job Description :  Oversee the daily operations of the community programsBuild and maintain relationships with existing affiliates and recruit new onesBuild and maintain relationships with existing affiliates and recruit new affiliates to join BCC Work closely with the marketing team to develop and optimize campaign pages and promotional materials for affiliatesMonitor and analyze affiliate performance to optimize campaigns accordinglyHandle project by dashboard MCN Requirement • Final year student or freshgraduated Bachelor's degree in Marketing, Communications Business, or related field • Excellent communication skills, both written and verbal • Have knowledge of affiliate marketing platforms and tools• Familiarity with social media platforms and digital marketing tools • Have good communication and negotiation skills • Proficiency in Microsoft Office Suite (Word, Excel, PowerPoint) • Detail-oriented with strong organizational and time management skills • Creative thinking and problem-solving abilities• Available to work from office Lihat Lebih Sedikit",https://glints.com/id/opportunities/jobs/internship-community/b6c6a586-6426-4cc5-b6ef-f0d875944618?utm_referrer=explore&traceInfo=2706a172-3070-4025-b3ac-1f5d5e9fbf05,https://images.glints.com/unsafe/glints-dashboard.oss-ap-southeast-1.aliyuncs.com/company-logo/8498ed986f01d8b360fbb9ea0e137933.png
MAREKTING KAIN,CKP Textile,Marketing,Penuh Waktu · Kerja di kantor,Minimal Diploma (D1 - D4),1 - 3 tahun pengalaman,"Deskripsi pekerjaan MAREKTING KAIN CKP TextileKualifikasi :﻿﻿Pendidikan Min. D3/Sederajat﻿﻿Bersedia ditempatkan diluar kota.﻿﻿Usia 25-35 thn.﻿﻿Jujur, teliti dan bertanggung jawab﻿﻿Memiliki kemampuan komunikasi, persentasi, persuasif dan negosiasi yang baik.﻿﻿Memiliki pemahaman dalam strategi penjualan dan pencapaian target yang baik terutama dalam membuka market baru.﻿﻿Mampu memahami product knowledge dengan baik.Deskripsi Pekerjaan :﻿﻿Berkomunikasi dan negosiasi dengan customer dengan baik.﻿﻿Follow up order yang sudah masuk.﻿﻿Bekerja sesuai dengan prosedur yang telah ditetapkan perusahaan﻿﻿Tekun, ulet dan bertanggung jawab terhadap pekerjaan. Lihat Lebih Sedikit",https://glints.com/id/opportunities/jobs/marekting-kain/e0a689e1-1855-450b-88af-1da1d8645aea?utm_referrer=explore&traceInfo=2706a172-3070-4025-b3ac-1f5d5e9fbf05,https://images.glints.com/unsafe/glints-dashboard.oss-ap-southeast-1.aliyuncs.com/company-logo/acd12bbb647794e639ee026327f716b2.png
Social Media Content Specialist,Farbash Perfume,Marketing,Penuh Waktu · Kerja di kantor,Minimal SMA/SMK,1 - 3 tahun pengalaman,Deskripsi pekerjaan Social Media Content Specialist Farbash PerfumeDetail dan creative up to date dengan trendTake & Edit video,https://glints.com/id/opportunities/jobs/social-media-content-specialist/06ba0026-9bac-4db2-8fb0-9830f2e734a5?utm_referrer=explore&traceInfo=2706a172-3070-4025-b3ac-1f5d5e9fbf05,https://images.glints.com/unsafe/glints-dashboard.oss-ap-southeast-1.aliyuncs.com/company-logo/e8eeaafe6ea7c1c3d3eaaa016ce3bea5.jpg
Sales Representative - Surabaya,PT Prima Aktif Nusantara,Marketing,Penuh Waktu · Kerja di kantor,Minimal SMA/SMK,1 - 3 tahun pengalaman,"Deskripsi pekerjaan Sales Representative - Surabaya PT Prima Aktif NusantaraJob RequirementsMax. 30 years oldMin. High School education or equivalentPassionate in Wine & Spirit industryAt least 2 years experience in Beverage Industry (Wine and Spirit)Able to operate Ms. Office (Word, Excel, and Power Point)Effective time management & ability to prioritize taskAble to work well under pressure to meet tight deadlinesAble to work long hour and occasionally over the weekendA highly motivated individual who is willing to take initiative & follow up with detailsGood team player & have a positive mindset when meet obstaclesGreat communication & negotiation skillBenefitBasic SalaryBonusTransport AllowanceLihat Lebih Sedikit",https://glints.com/id/opportunities/jobs/sales-representative-surabaya/7e5735e2-51a8-4c58-a337-bfde13d75f64?utm_referrer=explore&traceInfo=2706a172-3070-4025-b3ac-1f5d5e9fbf05,https://images.glints.com/unsafe/glints-dashboard.oss-ap-southeast-1.aliyuncs.com/company-logo/242fbac4aa474cf6e31764fd15f75f9d.jpg
Sales Representative - Jakarta,PT Prima Aktif Nusantara,Marketing,Penuh Waktu · Kerja di kantor,Minimal SMA/SMK,1 - 3 tahun pengalaman,"Deskripsi pekerjaan Sales Representative - Jakarta PT Prima Aktif NusantaraJob RequirementsMax. 30 years oldMin. High School education or equivalentPassionate in Wine & Spirit industryAt least 2 years experience in Beverage Industry (Wine and Spirit)Able to operate Ms. Office (Word, Excel, and Power Point)Effective time management & ability to prioritize taskAble to work well under pressure to meet tight deadlinesAble to work long hour and occasionally over the weekendA highly motivated individual who is willing to take initiative & follow up with detailsGood team player & have a positive mindset when meet obstaclesGreat communication & negotiation skillBenefitBasic SalaryBonusTransport AllowanceLihat Lebih Sedikit",https://glints.com/id/opportunities/jobs/sales-representative-jakarta/418288d2-d2ec-48f1-9e7c-9fc0bddaffe2?utm_referrer=explore&traceInfo=2706a172-3070-4025-b3ac-1f5d5e9fbf05,https://images.glints.com/unsafe/glints-dashboard.oss-ap-southeast-1.aliyuncs.com/company-logo/242fbac4aa474cf6e31764fd15f75f9d.jpg
Product Marketing Representative,Manunggal Group,Marketing,Penuh Waktu · Kerja di kantor,Minimal SMA/SMK,1 - 3 tahun pengalaman,"Deskripsi pekerjaan Product Marketing Representative Manunggal GroupJob DescriptionsMembuat rencana pengelolaan produk, strategi produk dan aktivitas pemasaranMencari peluang penjualan dan menjalin jaringan dengan calon pelangganMelakukan presentasi produk dan memasarkan produk kepada calon pelangganMelakukan analisa dan riset terhadap kompetitorMenjual produk sesuai dengan target Melakukan negosiasi dan menangani keluhan serta memberikan layanan berkualitas tinggi kepada pelangganMengadakan kunjungan rutin ke pelanggan dan menginformasikan segala kegiatan yang berkaitan dengan pelangganJob RequirementsPendidikan minimal D3 Bisnis, Marketing, IT atau bidang terkaitBerpengalaman minimal 1 tahun di industri IT dan passion di bidang penjualan dan atau Industri bidang ITProaktif, berinisiatif tinggi dan berorientasi pada tujuan dan hasilMemiliki SIM A diutamakan dan bersedia bekerja mobileTerbiasa dengan target penjualanKomunikatif, atraktif dan cepat belajarLihat Lebih Sedikit",https://glints.com/id/opportunities/jobs/product-marketing-representative/ce8a22d4-2fc8-4982-8ccc-8e1207c98822?utm_referrer=explore&traceInfo=2706a172-3070-4025-b3ac-1f5d5e9fbf05,https://images.glints.com/unsafe/glints-dashboard.oss-ap-southeast-1.aliyuncs.com/company-logo/0f9d541f734944a543a990ab6ff71f22.jpg
Sales Representative - Jakarta,PT Prima Aktif Nusantara,Marketing,Penuh Waktu · Kerja di kantor,Minimal SMA/SMK,1 - 3 tahun pengalaman,"Deskripsi pekerjaan Sales Representative - Jakarta PT Prima Aktif NusantaraJob RequirementsMax. 30 years oldMin. High School education or equivalentPassionate in Wine & Spirit industryAt least 2 years experience in Beverage Industry (Wine and Spirit)Able to operate Ms. Office (Word, Excel, and Power Point)Effective time management & ability to prioritize taskAble to work well under pressure to meet tight deadlinesAble to work long hour and occasionally over the weekendA highly motivated individual who is willing to take initiative & follow up with detailsGood team player & have a positive mindset when meet obstaclesGreat communication & negotiation skillBenefitBasic SalaryBonusTransport AllowanceLihat Lebih Sedikit",https://glints.com/id/opportunities/jobs/sales-representative-jakarta/418288d2-d2ec-48f1-9e7c-9fc0bddaffe2?utm_referrer=explore&traceInfo=7f662444-704b-4399-a696-71cbc20f4aec,https://images.glints.com/unsafe/glints-dashboard.oss-ap-southeast-1.aliyuncs.com/company-logo/242fbac4aa474cf6e31764fd15f75f9d.jpg
Product Marketing Representative,Manunggal Group,Marketing,Penuh Waktu · Kerja di kantor,Minimal SMA/SMK,1 - 3 tahun pengalaman,"Deskripsi pekerjaan Product Marketing Representative Manunggal GroupJob DescriptionsMembuat rencana pengelolaan produk, strategi produk dan aktivitas pemasaranMencari peluang penjualan dan menjalin jaringan dengan calon pelangganMelakukan presentasi produk dan memasarkan produk kepada calon pelangganMelakukan analisa dan riset terhadap kompetitorMenjual produk sesuai dengan target Melakukan negosiasi dan menangani keluhan serta memberikan layanan berkualitas tinggi kepada pelangganMengadakan kunjungan rutin ke pelanggan dan menginformasikan segala kegiatan yang berkaitan dengan pelangganJob RequirementsPendidikan minimal D3 Bisnis, Marketing, IT atau bidang terkaitBerpengalaman minimal 1 tahun di industri IT dan passion di bidang penjualan dan atau Industri bidang ITProaktif, berinisiatif tinggi dan berorientasi pada tujuan dan hasilMemiliki SIM A diutamakan dan bersedia bekerja mobileTerbiasa dengan target penjualanKomunikatif, atraktif dan cepat belajarLihat Lebih Sedikit",https://glints.com/id/opportunities/jobs/product-marketing-representative/ce8a22d4-2fc8-4982-8ccc-8e1207c98822?utm_referrer=explore&traceInfo=7f662444-704b-4399-a696-71cbc20f4aec,https://images.glints.com/unsafe/glints-dashboard.oss-ap-southeast-1.aliyuncs.com/company-logo/0f9d541f734944a543a990ab6ff71f22.jpg
Account Executive,PT Nutrisius Sari Persada,Marketing,Penuh Waktu · Kerja di kantor,Minimal Diploma (D1 - D4),1 - 3 tahun pengalaman,Deskripsi pekerjaan Account Executive PT Nutrisius Sari PersadaKualifikasi :Pendidikan minimal D3Pengalaman minimal 1 tahun di level pekerjaan dan industri yang sama (B2B)Pengalaman di bidang Sales MT menjadi nilai plusTerbiasa bekerja dengan targetMemiliki skill komunikasi dan negosiasiStrategic thingkingMahir bahasa inggri (lebih disukai)Job DescriptionMengelola proses penjualan sesuai sales pipelineMengelola proses customer relationship managementMelaksanakan program - program yang bertujuan untuk meningkatkan engagement dan loyalitas customerMengelola pelayanan pelangganLihat Lebih Sedikit,https://glints.com/id/opportunities/jobs/account-executive/24dfc188-8f7c-43c0-9341-fd054b10d6e3?utm_referrer=explore&traceInfo=7f662444-704b-4399-a696-71cbc20f4aec,https://images.glints.com/unsafe/glints-dashboard.oss-ap-southeast-1.aliyuncs.com/company-logo/65093ede1505a64f6d9855bb33fbb9fc.jpg
Affiliator Specialist,Proline Innovation Indonesia,Marketing,Penuh Waktu · Kerja di kantor,Minimal Sarjana (S1),1 - 3 tahun pengalaman,"Deskripsi pekerjaan Affiliator Specialist Proline Innovation IndonesiaKualifikasi:- Pendidikan Minimal S1 di bidang pemasaran, komunikasi, atau farmasi.- Minimal 1-2 tahun pengalaman di bidang digital marketing, khususnya dalam mengelola program afiliasi.- Berpengalaman menggunakan berbagai platform afiliasi seperti Affilo, Admitad, atau lainnya.- Mampu menganalisis data kinerja kampanye afiliasi untuk mengoptimalkan hasil.- Memahami berbagai channel marketing digital seperti SEO, SEM, sosial media, dan email marketing.- Memahami berbagai jenis produk skincare, manfaat, dan target konsumen.- Memiliki minat yang tinggi terhadap tren kecantikan terbaru.- Mampu menjelaskan manfaat dan keunggulan produk skincare kepada afiliasi dan calon konsumen.- Mampu menulis konten yang menarik dan persuasif untuk mempromosikan produk.- Memiliki kemampuan komunikasi yang baik, baik secara lisan maupun tulisan.- Menguasai bahasa Inggris dengan baik merupakan nilai tambah.Jobdesk:- Mencari dan merekrut afiliasi baru yang relevan dengan produk skincare perusahaan.- Membangun hubungan yang baik dengan afiliasi yang sudah ada.- Mengembangkan strategi afiliasi yang efektif untuk mencapai target penjualan.- Melacak kinerja kampanye afiliasi dan melakukan optimasi secara berkala.- Mengatur dan memantau aktivitas afiliasi pada platform afiliasi yang digunakan.- Menyelesaikan masalah teknis yang terkait dengan platform afiliasi.- Menyiapkan laporan kinerja program afiliasi secara berkala.Lihat Lebih Sedikit",https://glints.com/id/opportunities/jobs/affiliator-specialist/c2b73a73-b9d7-4391-beeb-e7096191c8c4?utm_referrer=explore&traceInfo=7f662444-704b-4399-a696-71cbc20f4aec,https://images.glints.com/unsafe/glints-dashboard.oss-ap-southeast-1.aliyuncs.com/company-logo/5b8494ebfa477c90e0280cf9774b3a95.png
Marketplace Ads and CPAS Performance Specialist,Digivise Education,Marketing,Penuh Waktu · Kerja di kantor,Minimal SMA/SMK,1 - 3 tahun pengalaman,"Deskripsi pekerjaan Marketplace Ads and CPAS Performance Specialist Digivise EducationKualifikasi :- Berlokasi di Bandung - Usia maksimal 27 tahun - Berpengalaman di bidang terkait minimal 2 tahun - Unggul dalam menganalisis dan meneliti - Memiliki keterampilan manajemen waktu dan organisasi yang baik - Menguasai iklan Meta Ads (Termasuk CPAS) dan Marketplace - Memiliki keinginan untuk mencoba hal-hal baruTanggung Jawab :- Mengelola dan mengoptimalkan kampanye iklan di marketplace seperti Shopee, Lazada, Tiktok, Tokopedia.- Menggunakan fitur iklan di dalam marketplace untuk meningkatkan visibilitas dan penjualan produk.- Memantau dan menganalisis performa iklan serta melakukan penyesuaian strategi untuk mencapai target KPI.- Mengimplementasikan dan mengelola kampanye CPAS untuk meningkatkan kinerja iklan.- Berkolaborasi dengan tim internal dan mitra eksternal untuk memastikan keberhasilan kampanye CPAS.- Menganalisis data performa iklan dari berbagai platform untuk mendapatkan wawasan yang berguna.- Menyusun laporan performa iklan dan memberikan rekomendasi untuk peningkatan kinerja.- Mengembangkan strategi pemasaran digital yang efektif untuk mencapai tujuan bisnis.- Memantau pengeluaran iklan dan menyesuaikan strategi sesuai kebutuhan.Lihat Lebih Sedikit",https://glints.com/id/opportunities/jobs/marketplace-ads-and-cpas-performance-specialist/af7ac6e4-4712-4b7e-b629-5e5122ab1e2f?utm_referrer=explore&traceInfo=7f662444-704b-4399-a696-71cbc20f4aec,https://images.glints.com/unsafe/glints-dashboard.oss-ap-southeast-1.aliyuncs.com/company-logo/b21d4ca46d70fc67c0621fdeb483849b.png
Host Live Streaming,Hloop Indonesia,Marketing,Penuh Waktu · Kerja di kantor,Minimal SMA/SMK,1 - 3 tahun pengalaman,Deskripsi pekerjaan Host Live Streaming Hloop IndonesiaJob DescriptionsWAJIB PENGALAMAN DAN GOOD LOOKINGBerinteraksi secara aktif dengan audiensMenjaga ekspresi wajah dan aktif dalam berbicaraMenyampaikan konten dengan jelas dan memikat menggunakan kemampuan berbicara yang baik.Memahami tren dan topik yang sedang populer untuk menarik minat audiens.Memastikan kelancaran teknis selama siaran langsung.Mempromosikan dan memperkenalkan produk atau layanan perusahaan kepada audiens.Job RequirementsHOST LIVE UNTUK PEREMPUAN SAJA!Good Looking & Diutamakan tidak menggunakan jilbabBersedia bekerja 6 hari (Minggu Off)Kemampuan berbicara yang baik dan memiliki daya tarik di depan kamera.Kreatif dan mampu menghasilkan konten yang menarik dan menghibur.Keterampilan dalam membangun interaksi dengan audiens.Keterampilan teknis dasar dalam mengoperasikan peralatan streamingLihat Lebih Sedikit,https://glints.com/id/opportunities/jobs/host-live-streaming/c75fcc89-a656-48a3-9b3b-5c8c58688ef6?utm_referrer=explore&traceInfo=7f662444-704b-4399-a696-71cbc20f4aec,https://images.glints.com/unsafe/glints-dashboard.oss-ap-southeast-1.aliyuncs.com/company-logo/4590d2c9f0c67a66bed8202e250e78e8.jpg
Host Live Streaming,Heyxi Indonesia,Marketing,Penuh Waktu · Kerja di kantor,Minimal SMA/SMK,1 - 3 tahun pengalaman,"Deskripsi pekerjaan Host Live Streaming Heyxi IndonesiaKualifikasi : > Wanita > Umur 18-28 Th> Pendidikan Min. SMA/SMK Sedrajat > Pengalaman / Non pengalaman> Memahami Cara Kerja Live Streaming > Memahami Tiktok Dan Shopee> Berpenampilan menarik bisa makeup/Goodlooking> Jujur, Ulet, Ceria, Dan Mau Belajar > Mampu Bekerja Dalam Tim> Non-Hijab (CV Tanpa Hijab)
> Tinggi Badan minimal 160cm dan Berat Badan Profesional/ideal

Lihat Lebih Sedikit",https://glints.com/id/opportunities/jobs/host-live-streaming/0bb0cf1e-da23-4295-8199-71d855f49c69?utm_referrer=explore&traceInfo=7f662444-704b-4399-a696-71cbc20f4aec,https://images.glints.com/unsafe/glints-dashboard.oss-ap-southeast-1.aliyuncs.com/company-logo/88e785d5489a7737400845f37f384ba0.png
HOST LIVE (SHOPEE & TIKTOK),CV. NGESTI PRIMA MAKMUR,Marketing,Penuh Waktu · Kerja di kantor,Minimal SMA/SMK,1 - 3 tahun pengalaman,"Deskripsi pekerjaan HOST LIVE (SHOPEE & TIKTOK) CV. NGESTI PRIMA MAKMURJob descriptionSebagai host atau pembawa acara atau Live streaming sehari-hari baik di shopee, tiktok dan platform lainnya.Mampu mengidentifikasi tren terkini setiap harinya untuk mendapatkan lebih banyak daya tarik .Mempelajari detail produk dan memiliki pengetahuan produk yang mendalam untuk dipromosikan dalam live streaming.Buat laporan harian mengenai hasil live streaming (Total tampilan, sorotan, jumlah pemirsa teratas, total menit, pengikut baru, dll).Mengikuti training dan evaluasi setiap harinya setelah melakukan siaran live streaming, untuk meningkatkan performa dari evaluasi yang diberikan.Mempromosikan barang Brand secara detail kepada penonton untuk mendapatkan insight dan kuantitas target penjualan setiap harinya secara akumulatif.Kualifikasi :1. Wanita, berpenampilan menarik.2. Komunikatif dan dapat menyampaikan informasi secara jelas dan menarik.3. memiliki pengalaman sebagai host live streaming min. 6 bulan.4. Memiliki pengalaman sebagai barista dan pengetahuan tentang kopi menjadi nilai lebih.5. bersedia bekerja di sentul, bogorBenefit :gaji pokok, uang makan, Bonus (jika penjualan sesuai target)Lihat Lebih Sedikit",https://glints.com/id/opportunities/jobs/host-live-shopee-and-tiktok/d616a812-8c57-4fb1-8f9b-5bda2feb05cf?utm_referrer=explore&traceInfo=7f662444-704b-4399-a696-71cbc20f4aec,https://images.glints.com/unsafe/glints-dashboard.oss-ap-southeast-1.aliyuncs.com/company-logo/7845e1d0dd79b0cb63c7bc433c2bc52f.jpeg
digital marketing,PT mahakarya anugerah group,Marketing,Penuh Waktu · Kerja di kantor,Minimal SMA/SMK,Pengalaman kurang dari 1 tahun,"Deskripsi pekerjaan digital marketing PT mahakarya anugerah groupJob DescriptionsMembangun, menangani, dan mengelola akun media sosial perusahaanmampu mengoprasikan iklan di meta adsMembuat konten untuk situs web dan akun media sosial, termasuk grafis, blog, atau videoMenanggapi pertanyaan publik pada media sosialMembangun hubungan personal dan membantu menyatukan orang-orang dengan minat yang serupaMenjalankan promosi dan kampanye sosial secara teratur dan meninjau kampanyeBerkolaborasi dan melaksanakan kampanye pemasaran digital termasuk SEO/SEMMemantau perkembangan terbaru di situs dan tren media sosial atau teknologi terkiniJob RequirementsPendidikan minimal S1 Ilmu Komunikasi / MarketingPengalaman minimal 1 tahun di bidang yang samaKemampuan menulis dan berkomunikasi yang baikMahir dalam penggunaan META ADSPengetahuan dasar tentang SEO/SEMKemampuan dalam pembuatan konten dan pengelolaan platform media sosialKeterampilan analitis dan evaluasi yang baikLihat Lebih Sedikit",https://glints.com/id/opportunities/jobs/digital-marketing/7818e006-898d-4f60-8e0e-9e123e374ff4?utm_referrer=explore&traceInfo=7f662444-704b-4399-a696-71cbc20f4aec,https://images.glints.com/unsafe/glints-dashboard.oss-ap-southeast-1.aliyuncs.com/company-logo/33d94c63f39def950b35510e6d0005d7.png
Digital Marketing,Brojol Art and Collection Store,Marketing,Penuh Waktu · Kerja di kantor,Minimal SMA/SMK,1 - 3 tahun pengalaman,Deskripsi pekerjaan Digital Marketing Brojol Art and Collection Store1.  Jual produk melalui Marketplace online shop dan sosial media 2. Melayani customer dengan baik dan ramah3. Menjaga Toko 4. Mahir sosial media dan marketplace online shop5. Menyukai Keris dan barang antik lainnya 6. Tidak berhijabLihat Lebih Sedikit,https://glints.com/id/opportunities/jobs/digital-marketing/528a1e88-9042-4c49-a116-9ea540475e25?utm_referrer=explore&traceInfo=7f662444-704b-4399-a696-71cbc20f4aec,https://images.glints.com/unsafe/glints-dashboard.oss-ap-southeast-1.aliyuncs.com/company-logo/d8c36b6205e3850c706d380035699410.png
Marketing Properti,PT. ARCHICON EKA REKADAYA,Marketing,Penuh Waktu · Kerja di kantor,Minimal Diploma (D1 - D4),Pengalaman kurang dari 1 tahun,"Deskripsi pekerjaan Marketing Properti PT. ARCHICON EKA REKADAYALowongan Pekerjaan Posisi :MARKETING PROPERTIKualifikasi:- Pria/Wanita usia 24-35 Tahun - D3/Sl Semua Jurusan- Berpengalaman Marketing Min 2 Tahun ; Diutamakan Marketing Properti- Berpenampilan Menarik- Mempunyai Kendaraan- Bisa Bekerja dalam Tim dan Berorientasi pada Target- Aktif di sosial media - Pelamar diutamakan wilayah Mataram Lombok dan sekitarnya- Penempatan di Kota Mataram, Lombok Nusa Tenggara BaratFasilitas :Gaji pokok & BonusLihat Lebih Sedikit",https://glints.com/id/opportunities/jobs/marketing-properti/41896d1c-5478-482d-9a57-3d39ee8cb66f?utm_referrer=explore&traceInfo=7f662444-704b-4399-a696-71cbc20f4aec,https://images.glints.com/unsafe/glints-dashboard.oss-ap-southeast-1.aliyuncs.com/company-logo/5308d459c20c551135eeba590a6875e8.png
