title,company,category,status,min_edu,min_exp,description,urlJob,urlImg
Ecommerce Specialist,PT Langit Bumi Lestari - Sagomee,Marketing,Penuh Waktu · Kerja di kantor,Minimal Sarjana (S1),1 - 3 tahun pengalaman,"Deskripsi pekerjaan Ecommerce Specialist PT Langit Bumi Lestari - SagomeeTugas dan tanggung jawab :1. Membuat, mengeksekusi, dan evaluasi promo plan2. Koordinasi dengan tim design untuk membuat design banner dan SKU sesuai dengan ketentuan3. Membalas chat dan follow up pertanyaan 4. Melakukan follow up order dan koordinasi dengan tim gudang untuk proses packingPersyaratan :1. Menguasai platform tokopedia, shopee, dll2. Minimal pengalaman 2 tahun di ecommerceLihat Lebih Sedikit",https://glints.com/id/opportunities/jobs/ecommerce-specialist/df6eec00-6263-4217-b569-bacebab45ad7?utm_referrer=explore&traceInfo=5e3dad61-7e9e-47fc-8f1f-614a2b89a812,https://images.glints.com/unsafe/glints-dashboard.oss-ap-southeast-1.aliyuncs.com/company-logo/4a55c01bc540a2bd7a65b3ad69d1481a.png
Content Creative Marketing,CV Hassa Yasaguna Mulia,Marketing,Penuh Waktu · Kerja di kantor,Minimal Sarjana (S1),3 - 5 tahun pengalaman,"Deskripsi pekerjaan Content Creative Marketing CV Hassa Yasaguna MuliaCreative Marketing adalah peran yang menggabungkan kreativitas dengan keahlian pemasaran untuk menghasilkan konten yang menarik dan relevan untuk kampanye iklan klien. Seorang Creative Marketer berfokus pada pembuatan konten yang memikat dan berdampak, dengan penekanan khusus pada platform visual seperti TikTok, Instagram, dan penggunaan perangkat lunak pengeditan seperti Adobe Photoshop.Tanggung Jawab Pekerjaan:Ideasi Konten: Mengembangkan konsep-konsep kreatif untuk konten iklan yang menarik perhatian audiens target dan sesuai dengan pesan merek klien.Pembuatan Konten: Menghasilkan konten visual yang berkualitas tinggi, termasuk video pendek atau grafis, dengan menggunakan perangkat lunak pengeditan seperti Adobe Photoshop, Canva Design, atau perangkat lunak sejenis.Penggunaan Platform Visual: Memanfaatkan platform-platform visual seperti TikTok dan Instagram Reels untuk menyebarkan konten iklan secara organik atau melalui iklan berbayar.Konsistensi Branding: Memastikan bahwa semua konten yang dibuat mencerminkan identitas merek klien dan mematuhi pedoman branding yang telah ditetapkan.Kolaborasi Tim: Berkolaborasi dengan tim pemasaran dan klien untuk memahami kebutuhan dan tujuan kampanye serta mengintegrasikan strategi kreatif ke dalam rencana pemasaran yang lebih luas.

Kualifikasi Pekerjaan:Pengalaman dalam membuat konten visual untuk media sosial, kampanye, dan acaraPengetahuan dalam penulisan teks dan pembuatan kontenKemampuan untuk bekerja secara mandiri maupun kolaboratif dalam timSarjana di bidang Desain Grafis, Marketing, atau bidang terkaitPengalaman dalam industri fashion atau tekstil merupakan nilai tambahLihat Lebih Sedikit",https://glints.com/id/opportunities/jobs/content-creative-marketing/7f47ecce-9b8b-42d3-82c9-4b2b7c4bee8f?utm_referrer=explore&traceInfo=5e3dad61-7e9e-47fc-8f1f-614a2b89a812,https://images.glints.com/unsafe/glints-dashboard.oss-ap-southeast-1.aliyuncs.com/company-logo/723fc50da97a89b859f11c87a128bc7c.jpg
Content Researcher,Ama Production House,Marketing,Paruh Waktu · Hybrid,Minimal Diploma (D1 - D4),1 - 3 tahun pengalaman,"Deskripsi pekerjaan Content Researcher Ama Production HouseKriteria Content Researcher yang Kita Cari:- Kreatif Abis: Punya imajinasi yang luas dan suka nyoba hal-hal baru.- Update Terus: Selalu ngikutin tren terbaru di dunia sosial media.-  Jago Multitasking: Bisa ngerjain banyak tugas sekaligus tanpa kelabakan.- Punya Selera Humor yang kece, biar videonya makin asik!Tanggung Jawab:- Menciptakan konsep video yang inovatif dan sesuai dengan target audiens.- Membuat Script yang cocok dengan konsep video.- Mengikuti dan Guide shooting dengan client- Mengoptimalkan video untuk berbagai platform media sosial.Kualifikasi:- Memiliki portofolio video yang kuat - Short Form - Memahami prinsip-prinsip storytelling, scriptwriting dan copywriting.- Mampu bekerja dengan cepat dan efisien dalam tenggat waktu.Lihat Lebih Sedikit",https://glints.com/id/opportunities/jobs/content-researcher/1dfafc57-b56c-4750-8f2b-bab31585b415?utm_referrer=explore&traceInfo=5e3dad61-7e9e-47fc-8f1f-614a2b89a812,https://images.glints.com/unsafe/glints-dashboard.oss-ap-southeast-1.aliyuncs.com/company-logo/46a415c55ca80213b02b7e1f3554e211.jpeg
Digital Advertising Manager,Mykonos,Marketing,Penuh Waktu · Kerja di kantor,Minimal Sarjana (S1),3 - 5 tahun pengalaman,"Deskripsi pekerjaan Digital Advertising Manager MykonosResponsibilities:Plan, create, and execute digital advertising campaigns across multiple platforms (Google Ads, Meta Ads, TikTok, Instagram, LinkedIn, etc.).Optimize campaigns for maximum ROI, performance, and engagement.Monitor and analyze campaign performance, providing insights and recommendations for improvement.Utilising a range of techniques including paid search, SEO, SEM.Manage budgets and ensure cost-effective use of advertising spend.Managing metrics such as Google Analytics and Webmaster Tools.Qualification:Experience as a Digital Advertising ManagerExperience in developing and implementing digital marketing strategiesGood knowledge of all different digital marketing channelsGood knowledge and experience with online marketing tools and best practicesHands-on experience with SEO, Google Analytics and CRM softwareProven history of success in SEO, SEM, and Digital CampaignsStrong in campaign creationLihat Lebih Sedikit",https://glints.com/id/opportunities/jobs/digital-advertising-manager/43a8aeea-29b2-43d3-9777-a587a3838738?utm_referrer=explore&traceInfo=5e3dad61-7e9e-47fc-8f1f-614a2b89a812,https://images.glints.com/unsafe/glints-dashboard.oss-ap-southeast-1.aliyuncs.com/company-logo/a25f7e1fcb87d19896592adaabc358ee.jpg
Growth Marketing,PT. GEMILANG SEJAHTERA BERSATU,Marketing,Penuh Waktu · Kerja di kantor,Minimal Diploma (D1 - D4),1 - 3 tahun pengalaman,"Deskripsi pekerjaan Growth Marketing PT. GEMILANG SEJAHTERA BERSATUJob DescriptionsMelakukan Edukasi Perencanaan keuanganMembuat janji temu dengan client dan presentasiMenjalin hubungan kerja yang baik dan sehat dengan client dan seluruh teamMengikuti training dan aktifitas wajib yang diadakan perusahaan maupun kantor agencyMembangun Team work yang positif dan saling supportJob RequirementsPendidikan minimal S1 Ilmu Komunikasi / MarketingPengalaman minimal 1 tahun di bidang yang samaKemampuan komunikasi verbal dan tertulis yang sangat baikKemampuan riset dan analisis yang kuatDomisili JabodetabekPunya ambisi besar untuk sukses, percaya diri, kemauan untuk belajar, Hi-tech dan mampu bekerja sama dengan baik dalam sebuah team.Belum pernah bergabung dalam perusahaan asuransi manapun (kecuali Bancassurance)Benefit PruVentureMengikuti program management training dari PT. Prudential IndonesiaJenjang karir yang jelas dengan Income memuaskanPendidikan dan pelatihan profesional selama 12 bulanAllowance bulanan, komisi dan bonusIncentif Trip dalam dan luar negeriLihat Lebih Sedikit",https://glints.com/id/opportunities/jobs/growth-marketing/9aef9531-17b1-474b-9b61-27878387d3cb?utm_referrer=explore&traceInfo=5e3dad61-7e9e-47fc-8f1f-614a2b89a812,https://images.glints.com/unsafe/glints-dashboard.oss-ap-southeast-1.aliyuncs.com/company-logo/3fabc6c4dfddc75d1d22b49e713bf7d1.jpg
Asisten Digital Advertising,PT UPGRADED MEDIA MANDIRI,Marketing,Penuh Waktu · Kerja di kantor,Minimal Diploma (D1 - D4),Pengalaman kurang dari 1 tahun,"Deskripsi pekerjaan Asisten Digital Advertising PT UPGRADED MEDIA MANDIRISebagai Digital Marketing Specialist di Upgraded, Anda akan bertanggung jawab untuk merancang, mengimplementasikan, dan mengelola strategi pemasaran digital yang efektif untuk meningkatkan visibilitas merek dan mencapai tujuan bisnis. Anda akan bekerja sama dengan tim pemasaran untuk menciptakan kampanye yang menarik dan berorientasi hasil.Tugas dan Tanggung Jawab:Merumuskan dan melaksanakan strategi pemasaran digital yang selaras dengan tujuan bisnis perusahaan.Mengelola dan mengoptimalkan kampanye iklan di platform digital seperti Google Ads, Facebook Ads, dan Instagram.Menganalisis data dan kinerja kampanye untuk memberikan laporan yang mendetail dan rekomendasi perbaikan.Mengelola konten media sosial dan website perusahaan untuk meningkatkan engagement dan trafik.Berkolaborasi dengan tim kreatif untuk menghasilkan konten yang menarik dan relevan.Melakukan riset pasar untuk memahami tren industri dan perilaku konsumen.Membangun hubungan dengan influencer dan mitra bisnis untuk meningkatkan jangkauan pemasaran.Requirement:Pendidikan minimal S1 di bidang Pemasaran, Komunikasi, atau bidang terkait.Pengalaman kerja minimal 2 tahun di bidang pemasaran digital.Pengetahuan yang kuat tentang SEO, SEM, email marketing, dan media sosial.Kemampuan analitis yang baik dengan pengalaman menggunakan alat analisis seperti Google Analytics.Kreatif, inovatif, dan mampu bekerja dalam tim maupun secara mandiri.Keterampilan komunikasi yang baik, baik lisan maupun tulisan.Familiar dengan alat pemasaran digital seperti Hootsuite, HubSpot, atau sejenisnya merupakan nilai tambah.Lihat Lebih Sedikit",https://glints.com/id/opportunities/jobs/asisten-digital-advertising/890f33c7-0634-44de-9377-e41acef39dbc?utm_referrer=explore&traceInfo=5e3dad61-7e9e-47fc-8f1f-614a2b89a812,https://images.glints.com/unsafe/glints-dashboard.oss-ap-southeast-1.aliyuncs.com/company-logo/89019ac1b12172512f6cdd1cba2cc552.png
Host Live Streaming,Afifah Collection,Marketing,Penuh Waktu · Kerja di kantor,Minimal SMA/SMK,Pengalaman kurang dari 1 tahun,"Deskripsi pekerjaan Host Live Streaming Afifah CollectionWe are hiring Host Live StreamingWanita muslimah berdomisili Jakarta BaratMaximal umur 25 tahunBerpengalaman 1th lebihCerewet, Bawel, ngomong terusPenggemar Fashion MuslimPercaya DiriDisiplin, Teliti, JujurMemiliki kendaraan sendiriPhotogenicMampu memasarkan Produk (bawel)Salary / gaji diinfokan lebih lanjut saat interviewLihat Lebih Sedikit",https://glints.com/id/opportunities/jobs/host-live-streaming/a44d8296-0e61-4028-a693-50c07d890ef5?utm_referrer=explore&traceInfo=5e3dad61-7e9e-47fc-8f1f-614a2b89a812,https://images.glints.com/unsafe/glints-dashboard.oss-ap-southeast-1.aliyuncs.com/company-logo/cde4602458cc0f2974b00be17aab5db8.jpg
KOL Specialist,PT. Hakuna Matata Pelaut,Marketing,Penuh Waktu · Kerja di kantor,Minimal Sarjana (S1),1 - 3 tahun pengalaman,"Deskripsi pekerjaan KOL Specialist PT. Hakuna Matata PelautJob Description :Involve in ideation/creation of influencer caimpaign in acquiring & maintaining KOL/Influencer.Selecting, dealing, arranging a meeting and reminding on each account to execute the campaign.Analyze & Manage overall KOLs network performance to create engaging social media content and design for communications, marketing tools, and promotion of product.Resposible for negotiateing with KOL such Celebgram, Tiktoker and influencer, build a good relationship with the KOLs.Assist the product of new launching brand and product, such as : packaging and sticker concept, PR package concept, social media content and teaser videoRequirement :Bachelor degree from any reputable universityHave experience in the same field minimum 2 yearsHaving a solid undestanding of how each social media channel works and how to build relationships with KOL and mediaKOL that match with te brand criteria & requirementSkill of negotiation, teamwork initiative instrict and strategical thinking.Pro-active & having knowledge how tu use excelHaving the knowledge of upcoming trends on social media (up-to-date)Lihat Lebih Sedikit",https://glints.com/id/opportunities/jobs/kol-specialist/a0b1bd0a-4046-4c24-b477-31667bd25947?utm_referrer=explore&traceInfo=5e3dad61-7e9e-47fc-8f1f-614a2b89a812,https://images.glints.com/unsafe/glints-dashboard.oss-ap-southeast-1.aliyuncs.com/company-logo/6695d266ff3e6a4faab1c6cf49eca02f.jpg
Interior Social Media Specialist,Graha Irass Interior,Marketing,Penuh Waktu · Kerja di kantor,Minimal Diploma (D1 - D4),1 - 3 tahun pengalaman,"Deskripsi pekerjaan Interior Social Media Specialist Graha Irass InteriorWe are Interior Design & Contractor is looking for a candidate with Interior Design Background that are interested to fill up the position for Social Media Marketing Specialist. He / She will be responsible fully on developing & managing social media strategies for our company. In addition, she will be exposed to all projects as assistant to Senior Designers in our company.The candidates would be responsible for :1) Manage content & posts in all social media channel, included whatsapp business and status, meta business, Instagram, TikTok, Facebook2) Update weekly social media report3) They acquire, catalog, and maintain collateral material such as films, video and audiotapes, photographs4) Making Calendar Plan & implementing as per schedule5) Updating Portofolio for company website & credentials6) Assisting on making 3D You will be considered if you have these criterias :1) Interior Design background : bachelor / D3 of Interior / Architecture2) Be able to use & understand basic Sketchup 3D & Render, Auto Cad3) Story Telling & experience of handling social media success4) Understanding for Google Analytics, Tiktok & able to use social media platformLihat Lebih Sedikit",https://glints.com/id/opportunities/jobs/interior-social-media-specialist/dee9b80b-8fe3-40c2-ace9-d874456a04c3?utm_referrer=explore&traceInfo=5e3dad61-7e9e-47fc-8f1f-614a2b89a812,https://images.glints.com/unsafe/glints-dashboard.oss-ap-southeast-1.aliyuncs.com/company-logo/77c072efaf9ee8e602507ce67562241e.jpg
Video Content Creator,Footprints Tennis,Marketing,Penuh Waktu · Kerja di kantor,Minimal SMA/SMK,Pengalaman kurang dari 1 tahun,"Deskripsi pekerjaan Video Content Creator Footprints TennisKami membuka lowongan pekerjaan sebagai Karyawan Video Content CreatorJob Desc:1. Produksi konten olahraga serta produk peralatan Tennis untuk di sosial media.2. Mampu produksi minimal 5 konten perhari.3. Berbicara lancar di depan kamera.4. Bisa menjadi live host untuk live shopping.5. Menghasilkan ide-ide kreatif untuk konten visual dan tulisan yang sesuai dengan brand.6. Mampu mengoperasikan software editing photo dan video.7. Mengelola kalender konten dan memastikan konsistensi dalam posting konten.8. Mengukur dan menganalisis performa konten dengan menggunakan tools analitik, serta mengoptimalkan strategi berdasarkan data.9. Mengikuti trend industri & algoritma terbaru.10. Menjaga estetika visual yang sesuai dengan karakter dan citra perusahaan.11. Nilai tambah apabila memiliki keahlian, hobi atau rutin main tennisPersyaratan:Pria atau Wanita, berusia 18-30 tahun.Pendidikan Minimal SMA / SMK Sederajat.Tidak sedang kuliah atau memiliki usaha sampingan (FULL TIME).Memiliki ketertarikan dalam bidang olahraga.Cekatan, jujur, dan memiliki integritas yang tinggi.Memiliki inisiatif yang tinggi.Ingin selalu belajar demi memberikan yang terbaik.Memiliki loyalitas tinggi.Memiliki kendaraan pribadi.Diutamakan domisili Jakarta Barat / Tangerang / Cipondoh.Tempat kerja berada di Green Lake City.Jam kerja Senin - Jumat 09.00 - 17.00.Jam kerja Sabtu 09.00 - 14.00.Mohon Melampirkan PortofolioPERHATIAN! Posisi pekerjaan ini hanya untuk yang serius bekerja keras dengan semangat belajar tinggi dan perbaikan berkelanjutan. BUKAN UNTUK YANG ASAL MELAMAR KERJA!Lihat Lebih Sedikit",https://glints.com/id/opportunities/jobs/video-content-creator/96650688-0166-4f27-ae59-519503e42076?utm_referrer=explore&traceInfo=5e3dad61-7e9e-47fc-8f1f-614a2b89a812,https://images.glints.com/unsafe/glints-dashboard.oss-ap-southeast-1.aliyuncs.com/company-logo/f895347b87ea4287a5e419cf23d0ddab.jpg
Digital Marketing Manager,PT ARTA TATA MANDIRI,Marketing,Penuh Waktu · Kerja di kantor,Minimal SMA/SMK,3 - 5 tahun pengalaman,"Deskripsi pekerjaan Digital Marketing Manager PT ARTA TATA MANDIRI1. Menyusun perencanaan promosi produk melalui channel digital 2. Membuat konsep kampanye pemasaran digital 3. Merancang distribusi konten kampanye pemasaran digital di media sosial 4. Meningkatkan engagement pelanggan melalui konten di media sosial 5. Mengoptimasi peringkat laman perusahaan dan produk di search engine 6. Merencanakan, mengelola, dan mengawasi kampanye pemasaran digital 7. Menugaskan tanggung jawab kepada tim pemasaran 8. Mengukur dan menganalisis kinerja kampanyeLihat Lebih Sedikit",https://glints.com/id/opportunities/jobs/digital-marketing-manager/8c70b2c5-d344-455d-aa51-a4cf56d99b09?utm_referrer=explore&traceInfo=5e3dad61-7e9e-47fc-8f1f-614a2b89a812,https://images.glints.com/unsafe/glints-dashboard.oss-ap-southeast-1.aliyuncs.com/company-logo/95f358d2e358b042d3b14f5e0b94a60f.jpeg
Content Creator,Semangkok Boci,Marketing,Penuh Waktu · Kerja di kantor,Minimal SMA/SMK,1 - 3 tahun pengalaman,"Deskripsi pekerjaan Content Creator Semangkok BociDeskripsi Pekerjaan :1. Membuat konten harian, foto, video serta editing untuk post di sosial media2. Meriset Konten yang terekomendasi untuk FYP3. Membuat perencanaan Kalender KontenKualifikasi :Muslim/ MuslimahMin. S1 Semua JurusanMemiliki Laptop Memiliki skill foto, video serta editingBerpengalaman minimal 1 tahunLihat Lebih Sedikit",https://glints.com/id/opportunities/jobs/content-creator/c478c1b2-c580-47b1-83ad-21b18ff6b457?utm_referrer=explore&traceInfo=5e3dad61-7e9e-47fc-8f1f-614a2b89a812,https://images.glints.com/unsafe/glints-dashboard.oss-ap-southeast-1.aliyuncs.com/company-logo/c84cb7c48a55f0bb5d081ada61e23cda.png
Host Live Streaming,PT Cahaya Promo Nusantara,Marketing,Penuh Waktu · Kerja di kantor,Minimal SMA/SMK,1 - 3 tahun pengalaman,"Deskripsi pekerjaan Host Live Streaming PT Cahaya Promo NusantaraJob DescriptionsMenghadirkan siaran langsung yang menarik dan menghibur kepada audiens.Berinteraksi secara aktif dengan audiens melalui chat dan komentar.Menyampaikan konten dengan jelas dan memikat menggunakan kemampuan berbicara yang baik.Memahami tren dan topik yang sedang populer untuk menarik minat audiens.Memastikan kelancaran teknis selama siaran langsung.Mempromosikan dan memperkenalkan produk atau layanan perusahaan kepada audiens.Job RequirementsPendidikan minimal SMA atau setara.Pengalaman sebagai host live streaming, pembawa acara, atau posisi serupa diutamakan.Kemampuan berbicara yang baik dan memiliki daya tarik di depan kamera.Kreatif dan mampu menghasilkan konten yang menarik dan menghibur.Keterampilan dalam membangun interaksi dengan audiens.Keterampilan teknis dasar dalam mengoperasikan peralatan streamingLihat Lebih Sedikit",https://glints.com/id/opportunities/jobs/host-live-streaming/6f20939f-e189-4275-bb1b-ebcdf54dfd93?utm_referrer=explore&traceInfo=5e3dad61-7e9e-47fc-8f1f-614a2b89a812,https://images.glints.com/unsafe/glints-dashboard.oss-ap-southeast-1.aliyuncs.com/company-logo/fecd66d4b469da3c2b315c9a006d765b.jpg
Host Live Streaming,Light Holistic Space,Marketing,Penuh Waktu · Kerja di kantor,Minimal SMA/SMK,1 - 3 tahun pengalaman,Deskripsi pekerjaan Host Live Streaming Light Holistic Space1. WANITA2. USIA MAKS. 25 TAHUN3. DOMISILI TANGERANG/TAKSEL.4. MENGUASAI BROADGAST TUBLIC SPEAKING.5. AKTIF SOCIAL MEDIA TIKTOK & IG.6. HARD SELLING ORIENTED7. KREATIE & INOVATIE.S. KOMUNIKATIF & RAMAH.KIRIMKAN VIDEO PERKENALAN KAMUSalary dibahas saat interviewLihat Lebih Sedikit,https://glints.com/id/opportunities/jobs/host-live-streaming/6d5e840a-12f6-41c2-b00f-c9567b459efb?utm_referrer=explore&traceInfo=5e3dad61-7e9e-47fc-8f1f-614a2b89a812,https://images.glints.com/unsafe/glints-dashboard.oss-ap-southeast-1.aliyuncs.com/company-logo/008b739c9af46cd38182319f160fc350.jpg
Asisten Content Marketing,PALUGADARS Creative Entertainment,Marketing,Penuh Waktu · Kerja di kantor,Minimal SMP,1 - 3 tahun pengalaman,"Deskripsi pekerjaan Asisten Content Marketing PALUGADARS Creative Entertainment[ PALUGADARS x AB CONSULTANT FIRM HIRING ]Our house expanding again due to high-demand clients. We need more creative enthusiasts for our multiple upcoming projects, especially in “Social Media Specialist” which qualifies this aspect:1. Capable of working hybrid, from an office in Pasar Minggu, Jakarta Selatan, can 9 to 5 is not necessary but a plus point.2. Young and fast-paced women who can help deliver the project manager needs to lead the team.3. Familiar with the creative industry, or at least you keep updated with today’s TikTok trend.Benefits:1. Monthly salaries, consume and project bonuses.2. We actually bond and creative team, no strict parent rules here, stay wild and bold.3. Exposure to multiple big local corporate and international brands, great way to show off ur LinkedIn.Send ur CV and portfolio to our contact!Lihat Lebih Sedikit",https://glints.com/id/opportunities/jobs/asisten-content-marketing/087518f1-8d46-4424-bc35-13ef1be7a335?utm_referrer=explore&traceInfo=5e3dad61-7e9e-47fc-8f1f-614a2b89a812,https://images.glints.com/unsafe/glints-dashboard.oss-ap-southeast-1.aliyuncs.com/company-logo/843d8fd8eda50aa8ecc748abab38bfae.png
Staf Media dan Marketing,Yayasan Kilau Indonesia,Marketing,Magang · Kerja di kantor,Minimal SMA/SMK,3 - 5 tahun pengalaman,"Deskripsi pekerjaan Staf Media dan Marketing Yayasan Kilau IndonesiaMohon untuk pelamar agar dapat memperhatikan tiga poin di bawah ini sebelum memutuskan untuk melamar pekerjaan ini !!!

Deskripsi PekerjaanMenyusun strategi pemasaran melalui media digital dan konvensional.Mengelola platform media WhatsApp, email dan menaikkan traffic digital pada platform media sosial.Melakukan analisis terhadap performa kampanye pemasaran dan menyusun laporan evaluasi.Mampu mengambil dokumentasi, baik foto maupun video dengan penguasaan yang baik dalam setiap sudut pengambilan.Pekerjaan ini direkomendasikan untuk desainer grafis dan content creator dari level menengah hingga di atasnya yang siap kerja kantor dan lapangan.Lihat Lebih Sedikit",https://glints.com/id/opportunities/jobs/staf-media-dan-marketing/be396dee-bb23-4f8d-b5c0-539df0a29051?utm_referrer=explore&traceInfo=5e3dad61-7e9e-47fc-8f1f-614a2b89a812,https://images.glints.com/unsafe/glints-dashboard.oss-ap-southeast-1.aliyuncs.com/company-logo/b86e9e2265ae9c8ef3fa1280e24f8b78.jpg
sales associate,PT Urban Fashion Digital,Marketing,Penuh Waktu · Kerja di kantor,Minimal SMA/SMK,1 - 3 tahun pengalaman,"Deskripsi pekerjaan sales associate PT Urban Fashion Digital1. Male (min 165cm) & Female (min 160cm), 20 - 28 years old2. Min. education Senior High School or equivalent3. Passionate in Sports or fashion industry (knowledgeable in Sneakers/Running/Basketball/Football is an advantage)4. At least 1 year experience in marketing and retail industry5. Well dressed, fashionable, discipline and responsible6. Prioritize hospitality in communication with customers and team members7. Work in shift schedule, including weekends and holidays8. Placement at Margonda, Depok. Resident nearby is an advantageLihat Lebih Sedikit",https://glints.com/id/opportunities/jobs/sales-associate/d1a5b4ad-800e-4ff3-b053-9607c6f12564?utm_referrer=explore&traceInfo=5e3dad61-7e9e-47fc-8f1f-614a2b89a812,https://images.glints.com/unsafe/glints-dashboard.oss-ap-southeast-1.aliyuncs.com/company-logo/80b93daba5c393db7775f915b6c5c26a.png
Petugas E-commerce,PT Indo Naraya Esa,Marketing,Paruh Waktu · Remote/Dari rumah,Minimal SMA/SMK,Pengalaman kurang dari 1 tahun,"Deskripsi pekerjaan Petugas E-commerce PT Indo Naraya EsaKualifikasi:Berpengalaman mengelola platform e-commerce Mampu upload produk, kelola stok, & memproses pesanan.Responsif dalam membalas chat pelanggan.Teliti, jujur, & bertanggung jawab.Fleksibel, bisa bekerja dari rumah.Paham dasar digital marketing (nilai plus).Lihat Lebih Sedikit",https://glints.com/id/opportunities/jobs/petugas-e-commerce/78c707e6-8b7c-491d-a8d4-e804ce50fbaa?utm_referrer=explore&traceInfo=5e3dad61-7e9e-47fc-8f1f-614a2b89a812,https://images.glints.com/unsafe/glints-dashboard.oss-ap-southeast-1.aliyuncs.com/company-logo/bb855df06957b3422499aef3e2dc4111.jpeg
Social Media Specialist,ZONA RETAILINDO GRUP,Marketing,Penuh Waktu · Kerja di kantor,Minimal Sarjana (S1),1 - 3 tahun pengalaman,"Deskripsi pekerjaan Social Media Specialist ZONA RETAILINDO GRUPSocial Media SpecialistKualifikasi:Minimal pendidikan S1.Usia maksimal 28 tahun.Berpengalaman mengelola akun TikTok & Instagram minimal 1 tahun.Berpengalaman dalam membuat strategi social media planning, reporting, dan content marketing.Memahami proses produksi konten, termasuk pengambilan gambar/video dan editing.Menguasai tren media sosial terkini, termasuk algoritma TikTok dan Instagram.Kreatif, inovatif, dan mampu memberikan arahan kepada tim konten untuk memastikan kualitas hasil produksi.Mampu bekerja di bawah tekanan dengan target yang telah ditetapkan.Job Deskripsi:Mengelola keseluruhan aktivitas social media untuk meningkatkan engagement dan brand awareness.Membuat content calendar untuk TikTok, Instagram, dan platform media sosial lainnya.Melakukan riset mendalam terkait tren media sosial dan audiens untuk mengoptimalkan konten.Berkolaborasi dengan tim kreatif dan content creator untuk menciptakan konten yang relevan dan berkualitas.Memastikan setiap konten sesuai dengan branding perusahaan dan mendukung tujuan pemasaran.Membuat laporan performa media sosial secara berkala dengan memberikan analisis dan rekomendasi untuk pengembangan strategi.Mengawasi implementasi strategi media sosial dan memastikan konten diunggah sesuai dengan jadwal.Lihat Lebih Sedikit",https://glints.com/id/opportunities/jobs/social-media-specialist/44ec5706-6eaa-4f48-8431-162830515bdf?utm_referrer=explore&traceInfo=5e3dad61-7e9e-47fc-8f1f-614a2b89a812,https://images.glints.com/unsafe/glints-dashboard.oss-ap-southeast-1.aliyuncs.com/company-logo/68b0afd21a86e8c3e8480a991cbb363b.png
